----------------------------------------------------------------------------
CrystalDiskInfo 9.1.1 (C) 2008-2023 hiyohiyo
                                Crystal Dew World: https://crystalmark.info/
----------------------------------------------------------------------------

    OS : Windows 10 Professional [10.0 Build 19045] (x64)
  Date : 2024/11/05 0:07:27

-- Controller Map ----------------------------------------------------------
 + Standard SATA AHCI Controller [ATA]
   - ST500DM002-1BD142
   - WDC WD5000AAKX-001CA0
   - PNY CS900 240GB SSD
   - WDC WD10EZEX-08WN4A1
 - Microsoft Storage Spaces Controller [SCSI]

-- Disk List ---------------------------------------------------------------
 (01) PNY CS900 240GB SSD : 240.0 GB [2/0/0, pd1] - ph
 (02) ST500DM002-1BD142 : 500.1 GB [0/0/0, pd1]
 (03) WDC WD5000AAKX-001CA0 : 500.1 GB [1/0/0, pd1]
 (04) WDC WD10EZEX-08WN4A1 : 1000.2 GB [3/0/0, pd1]

----------------------------------------------------------------------------
 (01) PNY CS900 240GB SSD
----------------------------------------------------------------------------
           Model : PNY CS900 240GB SSD
        Firmware : CS900612
   Serial Number : PNY40182253530204CE1
       Disk Size : 240.0 GB (8.4/137.4/240.0/240.0)
     Buffer Size : Unknown
     Queue Depth : 32
    # of Sectors : 468862128
   Rotation Rate : ---- (SSD)
       Interface : Serial ATA
   Major Version : ACS-4
   Minor Version : ----
   Transfer Mode : SATA/600 | SATA/600
  Power On Hours : 23078 hours
  Power On Count : 5745 count
     Host Writes : 58371 GB
     Temperature : 33 C (91 F)
   Health Status : Good (87 %)
        Features : S.M.A.R.T., NCQ, TRIM, GPL
       APM Level : ----
       AAM Level : ----
    Drive Letter : C:

-- S.M.A.R.T. --------------------------------------------------------------
ID Cur Wor Thr RawValues(6) Attribute Name
01 100 100 _50 000000000000 Read Error Rate
09 100 100 __0 000000005A26 Power on Hours
0C 100 100 __0 000000001671 Power Cycle Count
A8 100 100 __0 000000000000 SATA PHY Error Count
AA _90 _90 __0 0000000000A4 Bad Block Count
AD 100 100 __0 0000016A0188 Erase Count
C0 100 100 __0 000000001090 Unexpected Power Loss Count
C2 _67 _67 __0 002100210021 Temperature
DA 100 100 _50 00000000326E Number of CRC Error
E7 100 100 __0 000000000057 SSD Life Left
F1 100 100 __0 00000000E403 Host Writes

-- IDENTIFY_DEVICE ---------------------------------------------------------
        0    1    2    3    4    5    6    7    8    9
000: 0040 3FFF C837 0010 0000 0000 003F 0000 0000 0000
010: 504E 5934 3031 3832 3235 3335 3330 3230 3443 4531
020: 0000 0000 0000 4353 3930 3036 3132 504E 5920 4353
030: 3930 3020 3234 3047 4220 5353 4420 2020 2020 2020
040: 2020 2020 2020 2020 2020 2020 2020 8010 4000 2F00
050: 4000 0000 0000 0007 3FFF 0010 003F FC10 00FB 0110
060: FFFF 0FFF 0000 0007 0003 0078 0078 0078 0078 1F00
070: 0000 0000 0000 0000 0000 001F 850E 0006 004C 0040
080: 0FF8 0000 746B 7D01 4163 7469 BC01 4163 407F 000A
090: 001E 0000 FFFE 0000 0000 0000 0000 0000 0000 0000
100: 44B0 1BF2 0000 0000 0000 0008 4000 0000 5F8D B4C4
110: 0180 4CE1 0000 0000 0000 0000 0000 0000 0000 401C
120: 401C 0000 0000 0000 0000 0000 0000 0000 0029 0000
130: 0000 0000 0000 0000 0000 0000 0000 0000 0000 0000
140: 0000 0000 0000 0000 0000 0000 0000 0000 0000 0000
150: 0000 0000 0000 0000 0000 0000 0000 0000 0000 0000
160: 0000 0000 0000 0000 0000 0000 0000 0000 0003 0001
170: 0000 0000 0000 0000 0000 0000 0000 0000 0000 0000
180: 0000 0000 0000 0000 0000 0000 0000 0000 0000 0000
190: 0000 0000 0000 0000 0000 0000 0000 0000 0000 0000
200: 0000 0000 0000 0000 0000 0000 0000 0000 0000 4000
210: 0000 0000 0000 0000 0000 0000 0000 0001 0000 0000
220: 0000 0000 10FF 0000 0000 0000 0000 0000 0000 0000
230: 0000 0000 0000 0000 0001 FFFE 0000 0000 0000 0000
240: 0000 0000 0000 0000 0000 0000 0000 0000 0000 0000
250: 0000 0000 0000 0000 0000 25A5

-- SMART_READ_DATA ---------------------------------------------------------
     +0 +1 +2 +3 +4 +5 +6 +7 +8 +9 +A +B +C +D +E +F
000: 10 00 01 0B 00 64 64 00 00 00 00 00 00 00 09 12
010: 00 64 64 26 5A 00 00 00 00 00 0C 12 00 64 64 71
020: 16 00 00 00 00 00 A8 12 00 64 64 00 00 00 00 00
030: 00 00 AA 03 00 5A 5A A4 00 00 00 00 00 00 AD 12
040: 00 64 64 88 01 6A 01 00 00 00 C0 12 00 64 64 90
050: 10 00 00 00 00 00 C2 23 00 43 43 21 00 21 00 21
060: 00 00 DA 0B 00 64 64 6E 32 00 00 00 00 00 E7 13
070: 00 64 64 57 00 00 00 00 00 00 F1 12 00 64 64 03
080: E4 00 00 00 00 00 00 00 00 00 00 00 00 00 00 00
090: 00 00 00 00 00 00 00 00 00 00 00 00 00 00 00 00
0A0: 00 00 00 00 00 00 00 00 00 00 00 00 00 00 00 00
0B0: 00 00 00 00 00 00 00 00 00 00 00 00 00 00 00 00
0C0: 00 00 00 00 00 00 00 00 00 00 00 00 00 00 00 00
0D0: 00 00 00 00 00 00 00 00 00 00 00 00 00 00 00 00
0E0: 00 00 00 00 00 00 00 00 00 00 00 00 00 00 00 00
0F0: 00 00 00 00 00 00 00 00 00 00 00 00 00 00 00 00
100: 00 00 00 00 00 00 00 00 00 00 00 00 00 00 00 00
110: 00 00 00 00 00 00 00 00 00 00 00 00 00 00 00 00
120: 00 00 00 00 00 00 00 00 00 00 00 00 00 00 00 00
130: 00 00 00 00 00 00 00 00 00 00 00 00 00 00 00 00
140: 00 00 00 00 00 00 00 00 00 00 00 00 00 00 00 00
150: 00 00 00 00 00 00 00 00 00 00 00 00 00 00 00 00
160: 00 00 00 00 00 00 00 00 00 00 00 00 FF FF 00 79
170: 03 00 01 00 02 1E 06 1E 00 00 00 00 00 00 00 00
180: 00 00 00 00 00 00 00 00 00 00 00 00 00 00 00 00
190: 00 00 00 00 00 00 00 00 00 00 00 00 00 00 00 00
1A0: 00 00 00 00 00 00 00 00 00 00 00 00 00 00 00 00
1B0: 00 00 00 00 00 00 00 00 00 00 00 00 00 00 00 00
1C0: 00 00 00 00 00 00 00 00 00 00 00 00 00 00 00 00
1D0: 00 00 00 00 00 00 00 00 00 00 00 00 00 00 00 00
1E0: 00 00 00 00 00 00 00 00 00 00 00 00 00 00 00 00
1F0: 00 00 00 00 00 00 00 00 00 00 00 00 00 00 00 6B

-- SMART_READ_THRESHOLD ----------------------------------------------------
     +0 +1 +2 +3 +4 +5 +6 +7 +8 +9 +A +B +C +D +E +F
000: 10 00 01 32 00 00 00 00 00 00 00 00 00 00 09 00
010: 00 00 00 00 00 00 00 00 00 00 0C 00 00 00 00 00
020: 00 00 00 00 00 00 A8 00 00 00 00 00 00 00 00 00
030: 00 00 AA 00 00 00 00 00 00 00 00 00 00 00 AD 00
040: 00 00 00 00 00 00 00 00 00 00 C0 00 00 00 00 00
050: 00 00 00 00 00 00 C2 00 00 00 00 00 00 00 00 00
060: 00 00 DA 32 00 00 00 00 00 00 00 00 00 00 E7 00
070: 00 00 00 00 00 00 00 00 00 00 F1 00 00 00 00 00
080: 00 00 00 00 00 00 00 00 00 00 00 00 00 00 00 00
090: 00 00 00 00 00 00 00 00 00 00 00 00 00 00 00 00
0A0: 00 00 00 00 00 00 00 00 00 00 00 00 00 00 00 00
0B0: 00 00 00 00 00 00 00 00 00 00 00 00 00 00 00 00
0C0: 00 00 00 00 00 00 00 00 00 00 00 00 00 00 00 00
0D0: 00 00 00 00 00 00 00 00 00 00 00 00 00 00 00 00
0E0: 00 00 00 00 00 00 00 00 00 00 00 00 00 00 00 00
0F0: 00 00 00 00 00 00 00 00 00 00 00 00 00 00 00 00
100: 00 00 00 00 00 00 00 00 00 00 00 00 00 00 00 00
110: 00 00 00 00 00 00 00 00 00 00 00 00 00 00 00 00
120: 00 00 00 00 00 00 00 00 00 00 00 00 00 00 00 00
130: 00 00 00 00 00 00 00 00 00 00 00 00 00 00 00 00
140: 00 00 00 00 00 00 00 00 00 00 00 00 00 00 00 00
150: 00 00 00 00 00 00 00 00 00 00 00 00 00 00 00 00
160: 00 00 00 00 00 00 00 00 00 00 00 00 00 00 00 00
170: 00 00 00 00 00 00 00 00 00 00 00 00 00 00 00 00
180: 00 00 00 00 00 00 00 00 00 00 00 00 00 00 00 00
190: 00 00 00 00 00 00 00 00 00 00 00 00 00 00 00 00
1A0: 00 00 00 00 00 00 00 00 00 00 00 00 00 00 00 00
1B0: 00 00 00 00 00 00 00 00 00 00 00 00 00 00 00 00
1C0: 00 00 00 00 00 00 00 00 00 00 00 00 00 00 00 00
1D0: 00 00 00 00 00 00 00 00 00 00 00 00 00 00 00 00
1E0: 00 00 00 00 00 00 00 00 00 00 00 00 00 00 00 00
1F0: 00 00 00 00 00 00 00 00 00 00 00 00 00 00 00 43

----------------------------------------------------------------------------
 (02) ST500DM002-1BD142
----------------------------------------------------------------------------
           Model : ST500DM002-1BD142
        Firmware : KC45
   Serial Number : Z3TG7PWS
       Disk Size : 500.1 GB (8.4/137.4/500.1/500.1)
     Buffer Size : 16384 KB
     Queue Depth : 32
    # of Sectors : 976773168
   Rotation Rate : 7200 RPM
       Interface : Serial ATA
   Major Version : ATA8-ACS
   Minor Version : ATA8-ACS version 4
   Transfer Mode : SATA/600 | SATA/600
  Power On Hours : 30374 hours
  Power On Count : 9919 count
     Temperature : 44 C (111 F)
   Health Status : Caution
        Features : S.M.A.R.T., AAM, NCQ, GPL
       APM Level : ----
       AAM Level : D0D0h [ON]
    Drive Letter : D: F:

-- S.M.A.R.T. --------------------------------------------------------------
ID Cur Wor Thr RawValues(6) Attribute Name
01 111 _82 __6 0000020B2660 Read Error Rate
03 _98 _97 __0 000000000000 Spin-Up Time
04 _37 _37 _20 00000000FFFF Start/Stop Count
05 100 100 _36 000000000000 Reallocated Sectors Count
07 _71 _60 _30 00292473DD3F Seek Error Rate
09 _66 _66 __0 0000000076A6 Power-On Hours
0A 100 100 _97 000000000000 Spin Retry Count
0C _91 _91 _20 0000000026BF Power Cycle Count
B7 _94 _94 __0 000000000006 Vendor Specific
B8 100 100 _99 000000000000 End-to-End Error
BB __1 __1 __0 000000002532 Reported Uncorrectable Errors
BC 100 __1 __0 001D001D0834 Command Timeout
BD _71 _71 __0 00000000001D High Fly Writes
BE _56 _45 _45 00002E17002C Airflow Temperature
C2 _44 _55 __0 00080000002C Temperature
C3 _31 _27 __0 0000020B2660 Hardware ECC recovered
C5 100 100 __0 000000000008 Current Pending Sector Count
C6 100 100 __0 000000000008 Uncorrectable Sector Count
C7 200 _98 __0 00000000131D UltraDMA CRC Error Count
F0 100 253 __0 2A34000076AD Head Flying Hours
F1 100 253 __0 000070DA85F2 Total Host Writes
F2 100 253 __0 00000DD2D318 Total Host Reads

-- IDENTIFY_DEVICE ---------------------------------------------------------
        0    1    2    3    4    5    6    7    8    9
000: 0C5A 3FFF C837 0010 0000 0000 003F 0000 0000 0000
010: 2020 2020 2020 2020 2020 2020 5A33 5447 3750 5753
020: 0000 8000 0004 4B43 3435 2020 2020 5354 3530 3044
030: 4D30 3032 2D31 4244 3134 3220 2020 2020 2020 2020
040: 2020 2020 2020 2020 2020 2020 2020 8010 0000 2F00
050: 4000 0200 0200 0007 3FFF 0010 003F FC10 00FB 0110
060: FFFF 0FFF 0000 0007 0003 0078 0078 0078 0078 0000
070: 0000 0000 0000 0000 0000 001F 850E 0006 0048 0040
080: 01F0 0029 346B 7F01 4163 3469 BE01 4163 407F 0027
090: 0027 0000 FFFE 0000 D0D0 0000 0000 0000 0000 0000
100: 6030 3A38 0000 0000 0000 0000 6003 0000 5000 C500
110: 5027 A608 0000 0000 0000 0000 0000 0000 0000 401E
120: 401C 0000 0000 0000 0000 0000 0000 0000 0029 6030
130: 3A38 6030 3A38 2020 0002 0140 0100 5000 3C06 3C0A
140: 0000 003C 0000 0008 0000 0000 004F 0280 0000 0000
150: 0008 0000 0000 0000 0000 0000 0000 0000 3F00 99E0
160: 0000 0000 0000 0000 0000 0000 0000 0000 0000 0000
170: 0000 0000 0000 0000 0000 0000 0000 0000 0000 0000
180: 0000 0000 0000 0000 0000 0000 0000 0000 0000 0000
190: 0000 0000 0000 0000 0000 0000 0000 0000 0000 0000
200: 0000 0000 0000 0000 0000 0000 303F 0000 0000 4000
210: 0000 0000 0000 0000 0000 0000 0000 1C20 0000 0000
220: 0000 0000 1020 0000 0000 0000 0000 0000 0000 0000
230: 0000 0000 0000 0000 0000 0000 0000 0000 0000 0000
240: 0000 0000 0000 0000 0000 0000 0000 0000 0000 0000
250: 0000 0000 0000 0000 0000 9DA5

-- SMART_READ_DATA ---------------------------------------------------------
     +0 +1 +2 +3 +4 +5 +6 +7 +8 +9 +A +B +C +D +E +F
000: 0A 00 01 0F 00 6F 52 60 26 0B 02 00 00 00 03 03
010: 00 62 61 00 00 00 00 00 00 00 04 32 00 25 25 FF
020: FF 00 00 00 00 00 05 33 00 64 64 00 00 00 00 00
030: 00 00 07 0F 00 47 3C 3F DD 73 24 29 00 00 09 32
040: 00 42 42 A6 76 00 00 00 00 00 0A 13 00 64 64 00
050: 00 00 00 00 00 00 0C 32 00 5B 5B BF 26 00 00 00
060: 00 00 B7 32 00 5E 5E 06 00 00 00 00 00 00 B8 32
070: 00 64 64 00 00 00 00 00 00 00 BB 32 00 01 01 32
080: 25 00 00 00 00 00 BC 32 00 64 01 34 08 1D 00 1D
090: 00 00 BD 3A 00 47 47 1D 00 00 00 00 00 00 BE 22
0A0: 00 38 2D 2C 00 17 2E 00 00 00 C2 22 00 2C 37 2C
0B0: 00 00 00 08 00 00 C3 1A 00 1F 1B 60 26 0B 02 00
0C0: 00 00 C5 12 00 64 64 08 00 00 00 00 00 00 C6 10
0D0: 00 64 64 08 00 00 00 00 00 00 C7 3E 00 C8 62 1D
0E0: 13 00 00 00 00 00 F0 00 00 64 FD AD 76 00 00 34
0F0: 2A 06 F1 00 00 64 FD F2 85 DA 70 00 00 00 F2 00
100: 00 64 FD 18 D3 D2 0D 00 00 00 00 00 00 00 00 00
110: 00 00 00 00 00 00 00 00 00 00 00 00 00 00 00 00
120: 00 00 00 00 00 00 00 00 00 00 00 00 00 00 00 00
130: 00 00 00 00 00 00 00 00 00 00 00 00 00 00 00 00
140: 00 00 00 00 00 00 00 00 00 00 00 00 00 00 00 00
150: 00 00 00 00 00 00 00 00 00 00 00 00 00 00 00 00
160: 00 00 00 00 00 00 00 00 00 00 82 00 58 02 00 7B
170: 03 00 01 00 01 4F 02 00 00 00 00 00 00 00 00 00
180: 00 00 00 00 58 02 00 00 02 03 00 00 03 03 03 03
190: 03 00 00 00 00 00 00 00 00 01 00 00 00 00 00 00
1A0: 00 00 00 00 00 00 00 00 D7 D6 45 2B 77 63 00 00
1B0: 00 00 00 00 01 00 E1 60 F2 85 DA 70 37 6A 04 00
1C0: 18 D3 D2 0D FE A9 2C 00 00 00 00 00 ED FF F0 06
1D0: 00 00 00 35 00 00 00 00 FC 1B 00 00 33 00 04 00
1E0: 00 00 00 00 00 00 00 00 00 00 00 00 00 00 00 0C
1F0: 00 00 00 00 00 00 00 00 00 00 00 00 00 00 00 D7

-- SMART_READ_THRESHOLD ----------------------------------------------------
     +0 +1 +2 +3 +4 +5 +6 +7 +8 +9 +A +B +C +D +E +F
000: 01 00 01 06 00 00 00 00 00 00 00 00 00 00 03 00
010: 00 00 00 00 00 00 00 00 00 00 04 14 00 00 00 00
020: 00 00 00 00 00 00 05 24 00 00 00 00 00 00 00 00
030: 00 00 07 1E 00 00 00 00 00 00 00 00 00 00 09 00
040: 00 00 00 00 00 00 00 00 00 00 0A 61 00 00 00 00
050: 00 00 00 00 00 00 0C 14 00 00 00 00 00 00 00 00
060: 00 00 B7 00 00 00 00 00 00 00 00 00 00 00 B8 63
070: 00 00 00 00 00 00 00 00 00 00 BB 00 00 00 00 00
080: 00 00 00 00 00 00 BC 00 00 00 00 00 00 00 00 00
090: 00 00 BD 00 00 00 00 00 00 00 00 00 00 00 BE 2D
0A0: 00 00 00 00 00 00 00 00 00 00 C2 00 00 00 00 00
0B0: 00 00 00 00 00 00 C3 00 00 00 00 00 00 00 00 00
0C0: 00 00 C5 00 00 00 00 00 00 00 00 00 00 00 C6 00
0D0: 00 00 00 00 00 00 00 00 00 00 C7 00 00 00 00 00
0E0: 00 00 00 00 00 00 F0 00 00 00 00 00 00 00 00 00
0F0: 00 00 F1 00 00 00 00 00 00 00 00 00 00 00 F2 00
100: 00 00 00 00 00 00 00 00 00 00 00 00 00 00 00 00
110: 00 00 00 00 00 00 00 00 00 00 00 00 00 00 00 00
120: 00 00 00 00 00 00 00 00 00 00 00 00 00 00 00 00
130: 00 00 00 00 00 00 00 00 00 00 00 00 00 00 00 00
140: 00 00 00 00 00 00 00 00 00 00 00 00 00 00 00 00
150: 00 00 00 00 00 00 00 00 00 00 00 00 00 00 00 00
160: 00 00 00 00 00 00 00 00 00 00 00 00 00 00 00 00
170: 00 00 00 00 00 00 00 00 00 00 00 00 00 00 00 00
180: 00 00 00 00 00 00 00 00 00 00 00 00 00 00 00 00
190: 00 00 00 00 00 00 00 00 00 00 00 00 00 00 00 00
1A0: 00 00 00 00 00 00 00 00 00 00 00 00 00 00 00 00
1B0: 00 00 00 00 00 00 00 00 00 00 00 00 00 00 00 00
1C0: 00 00 00 00 00 00 00 00 00 00 00 00 00 00 00 00
1D0: 00 00 00 00 00 00 00 00 00 00 00 00 00 00 00 00
1E0: 00 00 00 00 00 00 00 00 00 00 00 00 00 00 00 00
1F0: 00 00 00 00 00 00 00 00 00 00 00 00 00 00 00 60

----------------------------------------------------------------------------
 (03) WDC WD5000AAKX-001CA0
----------------------------------------------------------------------------
           Model : WDC WD5000AAKX-001CA0
        Firmware : 15.01H15
   Serial Number : WD-WMAYU3035546
       Disk Size : 500.1 GB (8.4/137.4/500.1/500.1)
     Buffer Size : 16384 KB
     Queue Depth : 32
    # of Sectors : 976773168
   Rotation Rate : Unknown
       Interface : Serial ATA
   Major Version : ATA8-ACS
   Minor Version : ----
   Transfer Mode : SATA/600 | SATA/600
  Power On Hours : 6016 hours
  Power On Count : 2213 count
     Temperature : 49 C (120 F)
   Health Status : Good
        Features : S.M.A.R.T., NCQ, GPL
       APM Level : ----
       AAM Level : ----
    Drive Letter : E:

-- S.M.A.R.T. --------------------------------------------------------------
ID Cur Wor Thr RawValues(6) Attribute Name
01 200 200 _51 000000000000 Read Error Rate
03 141 139 _21 000000000F44 Spin-Up Time
04 _97 _97 __0 000000000E03 Start/Stop Count
05 200 200 140 000000000000 Reallocated Sectors Count
07 100 253 __0 000000000000 Seek Error Rate
09 _92 _92 __0 000000001780 Power-On Hours
0A 100 100 __0 000000000000 Spin Retry Count
0B 100 100 __0 000000000000 Recalibration Retries
0C _98 _98 __0 0000000008A5 Power Cycle Count
C0 200 200 __0 000000000280 Power-off Retract Count
C1 200 200 __0 000000000B82 Load/Unload Cycle Count
C2 _94 _84 __0 000000000031 Temperature
C4 200 200 __0 000000000000 Reallocation Event Count
C5 200 200 __0 000000000000 Current Pending Sector Count
C6 200 200 __0 000000000000 Uncorrectable Sector Count
C7 200 200 __0 000000000000 UltraDMA CRC Error Count
C8 200 200 __0 000000000001 Write Error Rate

-- IDENTIFY_DEVICE ---------------------------------------------------------
        0    1    2    3    4    5    6    7    8    9
000: 427A 3FFF C837 0010 0000 0000 003F 0000 0000 0000
010: 2020 2020 2057 442D 574D 4159 5533 3033 3535 3436
020: 0000 8000 0032 3135 2E30 3148 3135 5744 4320 5744
030: 3530 3030 4141 4B58 2D30 3031 4341 3020 2020 2020
040: 2020 2020 2020 2020 2020 2020 2020 8010 0000 2F00
050: 4001 0000 0000 0007 3FFF 0010 003F FC10 00FB 0110
060: FFFF 0FFF 0000 0007 0003 0078 0078 0078 0078 0000
070: 0000 0000 0000 0000 0000 001F 170E 0006 0044 0040
080: 01FE 0000 746B 7D61 4123 7469 BC41 4123 407F 0029
090: 0029 0000 FFFE 0000 0000 0000 0000 0000 0000 0000
100: 6030 3A38 0000 0000 0000 0000 0000 0000 5001 4EE0
110: 02D8 E561 0000 0000 0000 0000 0000 0000 0000 4018
120: 4018 0000 0000 0000 0000 0000 0000 0000 0029 0000
130: 0000 0000 0000 16FE 0125 0000 0000 0000 0000 0000
140: 0000 0000 0004 0000 0000 0000 0000 0000 0000 0000
150: 0000 0000 0000 0000 0000 0000 0000 0000 0000 0000
160: 0000 0000 0000 0000 0000 0000 0000 0000 0000 0000
170: 0000 0000 0000 0000 0000 0000 0000 0000 0000 0000
180: 0000 0000 0000 0000 0000 0000 0000 0000 0000 0000
190: 0000 0000 0000 0000 0000 0000 0000 0000 0000 0000
200: 0000 0000 0000 0000 0000 0000 3037 0000 0000 0000
210: 0000 0000 0000 0000 0000 0000 0000 0000 0000 0000
220: 0000 0000 103E 0000 0000 0000 0000 0000 0000 0000
230: 0000 0000 0000 0000 0001 1000 0000 0000 0000 0000
240: 0000 0000 0000 0000 0000 0000 0000 0000 0000 0000
250: 0000 0000 0000 0000 0000 AAA5

-- SMART_READ_DATA ---------------------------------------------------------
     +0 +1 +2 +3 +4 +5 +6 +7 +8 +9 +A +B +C +D +E +F
000: 10 00 01 2F 00 C8 C8 00 00 00 00 00 00 00 03 27
010: 00 8D 8B 44 0F 00 00 00 00 00 04 32 00 61 61 03
020: 0E 00 00 00 00 00 05 33 00 C8 C8 00 00 00 00 00
030: 00 00 07 2E 00 64 FD 00 00 00 00 00 00 00 09 32
040: 00 5C 5C 80 17 00 00 00 00 00 0A 32 00 64 64 00
050: 00 00 00 00 00 00 0B 32 00 64 64 00 00 00 00 00
060: 00 00 0C 32 00 62 62 A5 08 00 00 00 00 00 C0 32
070: 00 C8 C8 80 02 00 00 00 00 00 C1 32 00 C8 C8 82
080: 0B 00 00 00 00 00 C2 22 00 5E 54 31 00 00 00 00
090: 00 00 C4 32 00 C8 C8 00 00 00 00 00 00 00 C5 32
0A0: 00 C8 C8 00 00 00 00 00 00 00 C6 30 00 C8 C8 00
0B0: 00 00 00 00 00 00 C7 32 00 C8 C8 00 00 00 00 00
0C0: 00 00 C8 08 00 C8 C8 01 00 00 00 00 00 00 00 00
0D0: 00 00 00 00 00 00 00 00 00 00 00 00 00 00 00 00
0E0: 00 00 00 00 00 00 00 00 00 00 00 00 00 00 00 00
0F0: 00 00 00 00 00 00 00 00 00 00 00 00 00 00 00 00
100: 00 00 00 00 00 00 00 00 00 00 00 00 00 00 00 00
110: 00 00 00 00 00 00 00 00 00 00 00 00 00 00 00 00
120: 00 00 00 00 00 00 00 00 00 00 00 00 00 00 00 00
130: 00 00 00 00 00 00 00 00 00 00 00 00 00 00 00 00
140: 00 00 00 00 00 00 00 00 00 00 00 00 00 00 00 00
150: 00 00 00 00 00 00 00 00 00 00 00 00 00 00 00 00
160: 00 00 00 00 00 00 00 00 00 00 82 00 E0 1F 01 7B
170: 03 00 01 00 02 53 05 00 00 00 00 00 00 00 00 00
180: 00 00 01 02 00 00 00 00 00 00 00 00 00 00 00 00
190: 00 00 00 00 00 00 00 00 00 00 00 00 00 00 00 00
1A0: 00 00 00 00 00 00 00 00 00 00 00 00 00 00 00 00
1B0: 00 00 00 00 00 00 00 00 00 00 00 00 00 00 00 00
1C0: 00 00 00 00 00 00 00 00 00 00 00 00 00 00 00 00
1D0: 00 00 00 00 00 00 00 00 00 00 00 00 00 00 00 00
1E0: 00 00 00 00 00 00 00 00 00 00 00 00 00 00 00 00
1F0: 00 00 00 00 00 00 00 00 00 00 00 00 00 00 00 3C

-- SMART_READ_THRESHOLD ----------------------------------------------------
     +0 +1 +2 +3 +4 +5 +6 +7 +8 +9 +A +B +C +D +E +F
000: 10 00 01 33 C8 C8 00 00 00 00 00 00 00 00 03 15
010: 00 00 00 00 00 00 00 00 00 00 04 00 00 00 00 00
020: 00 00 00 00 00 00 05 8C 00 00 00 00 00 00 00 00
030: 00 00 07 00 64 64 00 00 00 00 00 00 00 00 09 00
040: 00 00 00 00 00 00 00 00 00 00 0A 00 00 00 00 00
050: 00 00 00 00 00 00 0B 00 00 00 00 00 00 00 00 00
060: 00 00 0C 00 00 00 00 00 00 00 00 00 00 00 C0 00
070: 00 00 00 00 00 00 00 00 00 00 C1 00 00 00 00 00
080: 00 00 00 00 00 00 C2 00 00 00 00 00 00 00 00 00
090: 00 00 C4 00 00 00 00 00 00 00 00 00 00 00 C5 00
0A0: 00 00 00 00 00 00 00 00 00 00 C6 00 00 00 00 00
0B0: 00 00 00 00 00 00 C7 00 00 00 00 00 00 00 00 00
0C0: 00 00 C8 00 C8 C8 00 00 00 00 00 00 00 00 00 00
0D0: 00 00 00 00 00 00 00 00 00 00 00 00 00 00 00 00
0E0: 00 00 00 00 00 00 00 00 00 00 00 00 00 00 00 00
0F0: 00 00 00 00 00 00 00 00 00 00 00 00 00 00 00 00
100: 00 00 00 00 00 00 00 00 00 00 00 00 00 00 00 00
110: 00 00 00 00 00 00 00 00 00 00 00 00 00 00 00 00
120: 00 00 00 00 00 00 00 00 00 00 00 00 00 00 00 00
130: 00 00 00 00 00 00 00 00 00 00 00 00 00 00 00 00
140: 00 00 00 00 00 00 00 00 00 00 00 00 00 00 00 00
150: 00 00 00 00 00 00 00 00 00 00 00 00 00 00 00 00
160: 00 00 00 00 00 00 00 00 00 00 00 00 00 00 00 00
170: 00 00 00 00 00 00 00 00 00 00 00 00 00 00 00 00
180: 00 00 00 00 00 00 00 00 00 00 00 00 00 00 00 00
190: 00 00 00 00 00 00 00 00 00 00 00 00 00 00 00 00
1A0: 00 00 00 00 00 00 00 00 00 00 00 00 00 00 00 00
1B0: 00 00 00 00 00 00 00 00 00 00 00 00 00 00 00 00
1C0: 00 00 00 00 00 00 00 00 00 00 00 00 00 00 00 00
1D0: 00 00 00 00 00 00 00 00 00 00 00 00 00 00 00 00
1E0: 00 00 00 00 00 00 00 00 00 00 00 00 00 00 00 00
1F0: 00 00 00 00 00 00 00 00 00 00 00 00 00 00 00 D5

----------------------------------------------------------------------------
 (04) WDC WD10EZEX-08WN4A1
----------------------------------------------------------------------------
           Model : WDC WD10EZEX-08WN4A1
        Firmware : 03.01A03
   Serial Number : WD-WCC6Y5NXAL62
       Disk Size : 1000.2 GB (8.4/137.4/1000.2/1000.2)
     Buffer Size : Unknown
     Queue Depth : 32
    # of Sectors : 1953525168
   Rotation Rate : 7200 RPM
       Interface : Serial ATA
   Major Version : ACS-3
   Minor Version : ACS-3 Revision 3b
   Transfer Mode : SATA/600 | SATA/600
  Power On Hours : 3573 hours
  Power On Count : 767 count
     Temperature : 44 C (111 F)
   Health Status : Good
        Features : S.M.A.R.T., APM, NCQ, GPL
       APM Level : 0080h [ON]
       AAM Level : ----
    Drive Letter : G:

-- S.M.A.R.T. --------------------------------------------------------------
ID Cur Wor Thr RawValues(6) Attribute Name
01 200 200 _51 000000000000 Read Error Rate
03 173 171 _21 000000000915 Spin-Up Time
04 _99 _99 __0 000000000607 Start/Stop Count
05 200 200 140 000000000000 Reallocated Sectors Count
07 200 200 __0 000000000000 Seek Error Rate
09 _96 _96 __0 000000000DF5 Power-On Hours
0A 100 100 __0 000000000000 Spin Retry Count
0B 100 100 __0 000000000000 Recalibration Retries
0C 100 100 __0 0000000002FF Power Cycle Count
C0 200 200 __0 00000000011C Power-off Retract Count
C1 199 199 __0 00000000132E Load/Unload Cycle Count
C2 _99 _82 __0 00000000002C Temperature
C4 200 200 __0 000000000000 Reallocation Event Count
C5 200 200 __0 000000000000 Current Pending Sector Count
C6 200 200 __0 000000000000 Uncorrectable Sector Count
C7 200 200 __0 000000000000 UltraDMA CRC Error Count
C8 200 200 __0 000000000000 Write Error Rate

-- IDENTIFY_DEVICE ---------------------------------------------------------
        0    1    2    3    4    5    6    7    8    9
000: 427A 3FFF C837 0010 0000 0000 003F 0000 0000 0000
010: 2020 2020 2057 442D 5743 4336 5935 4E58 414C 3632
020: 0000 0000 0000 3033 2E30 3141 3033 5744 4320 5744
030: 3130 455A 4558 2D30 3857 4E34 4131 2020 2020 2020
040: 2020 2020 2020 2020 2020 2020 2020 8010 4000 2F00
050: 4001 0000 0000 0006 3FFF 0010 003F FC10 00FB 0110
060: FFFF 0FFF 0000 0007 0003 0078 0078 0078 0078 0D00
070: 0000 0000 0000 0000 0000 001F 9F0E 0006 004C 0040
080: 07FE 001F 346B 7D09 6123 3469 BC09 6123 203F 8041
090: 8041 0080 FFFE 0000 0000 0000 0000 0000 0000 0000
100: 6DB0 7470 0000 0000 0000 0000 6003 0000 5001 4EE2
110: BFB1 222F 0000 0000 0000 0000 0000 0000 0000 401C
120: 401C 0000 0000 0000 0000 0000 0000 0000 0029 0000
130: 0000 0000 0000 0000 0000 0000 0000 0000 0000 0000
140: 0000 0000 0004 0000 0000 0000 0000 0000 0000 0000
150: 0000 0000 0000 0000 0000 0000 0000 0000 0000 0000
160: 0000 0000 0000 0000 0000 0000 0000 0000 0002 0000
170: 0000 0000 0000 0000 0000 0000 0000 0000 0000 0000
180: 0000 0000 0000 0000 0000 0000 0000 0000 0000 0000
190: 0000 0000 0000 0000 0000 0000 0000 0000 0000 0000
200: 0000 0000 0000 0000 0000 0000 3035 0000 0000 0000
210: 0000 0000 0000 0000 0000 0000 0000 1C20 0000 0000
220: 0000 0000 107E 0000 0000 0000 0000 0000 0000 0000
230: 0000 0000 0000 0000 0001 1000 0000 0000 0000 0000
240: 0000 0000 0000 0000 0000 0000 0000 0000 0000 0000
250: 0000 0000 0000 0000 0000 19A5

-- SMART_READ_DATA ---------------------------------------------------------
     +0 +1 +2 +3 +4 +5 +6 +7 +8 +9 +A +B +C +D +E +F
000: 10 00 01 2F 00 C8 C8 00 00 00 00 00 00 00 03 27
010: 00 AD AB 15 09 00 00 00 00 00 04 32 00 63 63 07
020: 06 00 00 00 00 00 05 33 00 C8 C8 00 00 00 00 00
030: 00 00 07 2E 00 C8 C8 00 00 00 00 00 00 00 09 32
040: 00 60 60 F5 0D 00 00 00 00 00 0A 32 00 64 64 00
050: 00 00 00 00 00 00 0B 32 00 64 64 00 00 00 00 00
060: 00 00 0C 32 00 64 64 FF 02 00 00 00 00 00 C0 32
070: 00 C8 C8 1C 01 00 00 00 00 00 C1 32 00 C7 C7 2E
080: 13 00 00 00 00 00 C2 22 00 63 52 2C 00 00 00 00
090: 00 00 C4 32 00 C8 C8 00 00 00 00 00 00 00 C5 32
0A0: 00 C8 C8 00 00 00 00 00 00 00 C6 30 00 C8 C8 00
0B0: 00 00 00 00 00 00 C7 32 00 C8 C8 00 00 00 00 00
0C0: 00 00 C8 08 00 C8 C8 00 00 00 00 00 00 00 00 00
0D0: 00 00 00 00 00 00 00 00 00 00 00 00 00 00 00 00
0E0: 00 00 00 00 00 00 00 00 00 00 00 00 00 00 00 00
0F0: 00 00 00 00 00 00 00 00 00 00 00 00 00 00 00 00
100: 00 00 00 00 00 00 00 00 00 00 00 00 00 00 00 00
110: 00 00 00 00 00 00 00 00 00 00 00 00 00 00 00 00
120: 00 00 00 00 00 00 00 00 00 00 00 00 00 00 00 00
130: 00 00 00 00 00 00 00 00 00 00 00 00 00 00 00 00
140: 00 00 00 00 00 00 00 00 00 00 00 00 00 00 00 00
150: 00 00 00 00 00 00 00 00 00 00 00 00 00 00 00 00
160: 00 00 00 00 00 00 00 00 00 00 82 00 68 2E 01 7B
170: 03 00 01 00 02 7B 05 00 00 00 00 00 00 00 00 00
180: 00 00 01 02 00 00 00 00 00 00 00 00 00 00 00 00
190: 00 00 00 00 00 00 00 00 00 00 00 00 00 00 00 00
1A0: 00 00 00 00 00 00 00 00 00 00 00 00 00 00 00 00
1B0: 00 00 00 00 00 00 00 00 00 00 00 00 00 00 00 00
1C0: 00 00 00 00 00 00 00 00 00 00 00 00 00 00 00 00
1D0: 00 00 00 00 00 00 00 00 00 00 00 00 00 00 00 00
1E0: 00 00 00 00 00 00 00 00 00 00 00 00 00 00 00 00
1F0: 00 00 00 00 00 00 00 00 00 00 00 00 00 00 00 2E

-- SMART_READ_THRESHOLD ----------------------------------------------------
     +0 +1 +2 +3 +4 +5 +6 +7 +8 +9 +A +B +C +D +E +F
000: 10 00 01 33 C8 C8 00 00 00 00 00 00 00 00 03 15
010: 00 00 00 00 00 00 00 00 00 00 04 00 00 00 00 00
020: 00 00 00 00 00 00 05 8C 00 00 00 00 00 00 00 00
030: 00 00 07 00 C8 C8 00 00 00 00 00 00 00 00 09 00
040: 00 00 00 00 00 00 00 00 00 00 0A 00 00 00 00 00
050: 00 00 00 00 00 00 0B 00 00 00 00 00 00 00 00 00
060: 00 00 0C 00 00 00 00 00 00 00 00 00 00 00 C0 00
070: 00 00 00 00 00 00 00 00 00 00 C1 00 00 00 00 00
080: 00 00 00 00 00 00 C2 00 00 00 00 00 00 00 00 00
090: 00 00 C4 00 00 00 00 00 00 00 00 00 00 00 C5 00
0A0: 00 00 00 00 00 00 00 00 00 00 C6 00 00 00 00 00
0B0: 00 00 00 00 00 00 C7 00 00 00 00 00 00 00 00 00
0C0: 00 00 C8 00 C8 C8 00 00 00 00 00 00 00 00 00 00
0D0: 00 00 00 00 00 00 00 00 00 00 00 00 00 00 00 00
0E0: 00 00 00 00 00 00 00 00 00 00 00 00 00 00 00 00
0F0: 00 00 00 00 00 00 00 00 00 00 00 00 00 00 00 00
100: 00 00 00 00 00 00 00 00 00 00 00 00 00 00 00 00
110: 00 00 00 00 00 00 00 00 00 00 00 00 00 00 00 00
120: 00 00 00 00 00 00 00 00 00 00 00 00 00 00 00 00
130: 00 00 00 00 00 00 00 00 00 00 00 00 00 00 00 00
140: 00 00 00 00 00 00 00 00 00 00 00 00 00 00 00 00
150: 00 00 00 00 00 00 00 00 00 00 00 00 00 00 00 00
160: 00 00 00 00 00 00 00 00 00 00 82 00 68 2E 01 7B
170: 03 00 01 00 02 7B 05 00 00 00 00 00 00 00 00 00
180: 00 00 01 02 00 00 00 00 00 00 00 00 00 00 00 00
190: 00 00 00 00 00 00 00 00 00 00 00 00 00 00 00 00
1A0: 00 00 00 00 00 00 00 00 00 00 00 00 00 00 00 00
1B0: 00 00 00 00 00 00 00 00 00 00 00 00 00 00 00 00
1C0: 00 00 00 00 00 00 00 00 00 00 00 00 00 00 00 00
1D0: 00 00 00 00 00 00 00 00 00 00 00 00 00 00 00 00
1E0: 00 00 00 00 00 00 00 00 00 00 00 00 00 00 00 00
1F0: 00 00 00 00 00 00 00 00 00 00 00 00 00 00 00 F0

